{
  "audit_version": 3,
  "kind": "sg_evals_github_repository_state",
  "observed_at": "2026-07-27T20:21:46.537292Z",
  "outcomes_consulted": false,
  "repository_count": 302,
  "repositories": [
    {
      "canonical_repository_id": "0x4d31/galah",
      "mirror_name": "github.com/sg-evals/0x4d31-galah",
      "exists": true,
      "is_fork": true,
      "parent": "0x4D31/galah",
      "visibility": "PUBLIC",
      "default_branch": "main",
      "head_oid": "8f77b85e892731cf1402963d8121c79fef0e59c7",
      "cutoff_oid": "8f77b85e892731cf1402963d8121c79fef0e59c7"
    },
    {
      "canonical_repository_id": "0xfurai/peekaping",
      "mirror_name": "github.com/sg-evals/0xfurai-peekaping",
      "exists": true,
      "is_fork": true,
      "parent": "0xfurai/peekaping",
      "visibility": "PUBLIC",
      "default_branch": "main",
      "head_oid": "742a60d94fdaacc977c09444b651f7cf1c1aab9e",
      "cutoff_oid": "742a60d94fdaacc977c09444b651f7cf1c1aab9e"
    },
    {
      "canonical_repository_id": "2dust/v2rayn",
      "mirror_name": "github.com/sg-evals/2dust-v2rayN",
      "exists": true,
      "is_fork": true,
      "parent": "2dust/v2rayN",
      "visibility": "PUBLIC",
      "default_branch": "master",
      "head_oid": "cf8dd45abe3dd54667a3ce0e6923695acbf10823",
      "cutoff_oid": "cf8dd45abe3dd54667a3ce0e6923695acbf10823"
    },
    {
      "canonical_repository_id": "3b1b/manim",
      "mirror_name": "github.com/sg-evals/3b1b-manim",
      "exists": true,
      "is_fork": true,
      "parent": "3b1b/manim",
      "visibility": "PUBLIC",
      "default_branch": "master",
      "head_oid": "6199a00d4c1b1127ebe45cb629c3f22538b10e13",
      "cutoff_oid": "6199a00d4c1b1127ebe45cb629c3f22538b10e13"
    },
    {
      "canonical_repository_id": "a16z/halmos",
      "mirror_name": "github.com/sg-evals/a16z-halmos",
      "exists": true,
      "is_fork": true,
      "parent": "a16z/halmos",
      "visibility": "PUBLIC",
      "default_branch": "main",
      "head_oid": "079bb4241d1b460baf986257d56ea86977d73451",
      "cutoff_oid": "079bb4241d1b460baf986257d56ea86977d73451"
    },
    {
      "canonical_repository_id": "addyosmani/agent-skills",
      "mirror_name": "github.com/sg-evals/addyosmani-agent-skills",
      "exists": true,
      "is_fork": true,
      "parent": "addyosmani/agent-skills",
      "visibility": "PUBLIC",
      "default_branch": "main",
      "head_oid": "ff2df4c07e7836a092ed28e1e9b42f4d6009280c",
      "cutoff_oid": "ff2df4c07e7836a092ed28e1e9b42f4d6009280c"
    },
    {
      "canonical_repository_id": "affaan-m/ecc",
      "mirror_name": "github.com/sg-evals/affaan-m-ECC",
      "exists": true,
      "is_fork": true,
      "parent": "affaan-m/ECC",
      "visibility": "PUBLIC",
      "default_branch": "main",
      "head_oid": "86c786e8bb3ff70e4d5ea6570ec3fcec0b6a93df",
      "cutoff_oid": "abe185c6a46c312d526c215abfcafe98ed9e951b"
    },
    {
      "canonical_repository_id": "aftership/clickhouse-sql-parser",
      "mirror_name": "github.com/sg-evals/aftership-clickhouse-sql-parser",
      "exists": true,
      "is_fork": true,
      "parent": "AfterShip/clickhouse-sql-parser",
      "visibility": "PUBLIC",
      "default_branch": "master",
      "head_oid": "e4c6e11fcec9a7140ef53835fae0728b2f304a3c",
      "cutoff_oid": "e4c6e11fcec9a7140ef53835fae0728b2f304a3c"
    },
    {
      "canonical_repository_id": "ag2ai/build-with-ag2",
      "mirror_name": "github.com/sg-evals/ag2ai-build-with-ag2",
      "exists": true,
      "is_fork": true,
      "parent": "ag2ai/build-with-ag2",
      "visibility": "PUBLIC",
      "default_branch": "main",
      "head_oid": "29eeac374d18003696d8725d88e76d20176034a1",
      "cutoff_oid": "29eeac374d18003696d8725d88e76d20176034a1"
    },
    {
      "canonical_repository_id": "ai-shifu/ai-shifu",
      "mirror_name": "github.com/sg-evals/ai-shifu-ai-shifu",
      "exists": true,
      "is_fork": true,
      "parent": "ai-shifu/ai-shifu",
      "visibility": "PUBLIC",
      "default_branch": "main",
      "head_oid": "f00956165e37fbdb29475fe70d45a1cfd4a76603",
      "cutoff_oid": "7c66eb46b36eee67be5862a58623cdd9ab3c8b78"
    },
    {
      "canonical_repository_id": "airbytehq/airbyte",
      "mirror_name": "github.com/sg-evals/airbytehq-airbyte",
      "exists": true,
      "is_fork": true,
      "parent": "airbytehq/airbyte",
      "visibility": "PUBLIC",
      "default_branch": "master",
      "head_oid": "4e6942ffaf179ad0c8fab0179814701d1c6bd142",
      "cutoff_oid": "926797c471d8741f7da77b1f8ed9663e51abdf7a"
    },
    {
      "canonical_repository_id": "airbytehq/pyairbyte",
      "mirror_name": "github.com/sg-evals/airbytehq-pyairbyte",
      "exists": true,
      "is_fork": true,
      "parent": "airbytehq/PyAirbyte",
      "visibility": "PUBLIC",
      "default_branch": "main",
      "head_oid": "173e7793ad61523d42bc77c31362703028749a79",
      "cutoff_oid": "6f539a8b715ef0b667ad0efc2adaf16e06d0d57f"
    },
    {
      "canonical_repository_id": "alacritty/alacritty",
      "mirror_name": "github.com/sg-evals/alacritty-alacritty",
      "exists": true,
      "is_fork": true,
      "parent": "alacritty/alacritty",
      "visibility": "PUBLIC",
      "default_branch": "master",
      "head_oid": "852e971cddfabe222d2d5bcda466e130f53af207",
      "cutoff_oid": "852e971cddfabe222d2d5bcda466e130f53af207"
    },
    {
      "canonical_repository_id": "aldinokemal/go-whatsapp-web-multidevice",
      "mirror_name": "github.com/sg-evals/aldinokemal-go-whatsapp-web-multidevice",
      "exists": true,
      "is_fork": true,
      "parent": "aldinokemal/go-whatsapp-web-multidevice",
      "visibility": "PUBLIC",
      "default_branch": "main",
      "head_oid": "08e005ff6dc91043d9113e2da307957e39311942",
      "cutoff_oid": "ee9d05da08768d35384f823494d4ed0a1643eef5"
    },
    {
      "canonical_repository_id": "alexanderjeurissen/ranger_devicons",
      "mirror_name": "github.com/sg-evals/alexanderjeurissen-ranger_devicons",
      "exists": true,
      "is_fork": true,
      "parent": "alexanderjeurissen/ranger_devicons",
      "visibility": "PUBLIC",
      "default_branch": "main",
      "head_oid": "1bcaff0366a9d345313dc5af14002cfdcddabb82",
      "cutoff_oid": "1bcaff0366a9d345313dc5af14002cfdcddabb82"
    },
    {
      "canonical_repository_id": "alirezamika/autoscraper",
      "mirror_name": "github.com/sg-evals/alirezamika-autoscraper",
      "exists": true,
      "is_fork": true,
      "parent": "alirezamika/autoscraper",
      "visibility": "PUBLIC",
      "default_branch": "master",
      "head_oid": "eb72f5dc6f7ffb6777684131d082d85f30a42b5a",
      "cutoff_oid": "eb72f5dc6f7ffb6777684131d082d85f30a42b5a"
    },
    {
      "canonical_repository_id": "angular/angular",
      "mirror_name": "github.com/sg-evals/angular-angular",
      "exists": true,
      "is_fork": true,
      "parent": "angular/angular",
      "visibility": "PUBLIC",
      "default_branch": "main",
      "head_oid": "5ad823139758b4d3a8a021d378b008c3457f8689",
      "cutoff_oid": "5ad823139758b4d3a8a021d378b008c3457f8689"
    },
    {
      "canonical_repository_id": "anomalyco/opencode",
      "mirror_name": "github.com/sg-evals/anomalyco-opencode",
      "exists": true,
      "is_fork": true,
      "parent": "anomalyco/opencode",
      "visibility": "PUBLIC",
      "default_branch": "dev",
      "head_oid": "8e8d38c3cd8eaecfde65c2a99ca3d035271afe6d",
      "cutoff_oid": "a85d8d23aa297b3051e642c28e3fc79b457fc4bc"
    },
    {
      "canonical_repository_id": "ansible/ansible",
      "mirror_name": "github.com/sg-evals/ansible-ansible",
      "exists": true,
      "is_fork": true,
      "parent": "ansible/ansible",
      "visibility": "PUBLIC",
      "default_branch": "devel",
      "head_oid": "4e131d639aabd9d4cecd589dc046582921487a41",
      "cutoff_oid": "76884711a617bfe59b417df11fbfc42016c99de8"
    },
    {
      "canonical_repository_id": "ant-design/ant-design",
      "mirror_name": "github.com/sg-evals/ant-design-ant-design",
      "exists": true,
      "is_fork": true,
      "parent": "ant-design/ant-design",
      "visibility": "PUBLIC",
      "default_branch": "master",
      "head_oid": "ee5cd3acd682f3db047d1381773d24502f7e67d4",
      "cutoff_oid": "29ea546eef68cf30079e66ed1b5751d881c8c86a"
    },
    {
      "canonical_repository_id": "anthropics/claude-code",
      "mirror_name": "github.com/sg-evals/anthropics-claude-code",
      "exists": true,
      "is_fork": true,
      "parent": "anthropics/claude-code",
      "visibility": "PUBLIC",
      "default_branch": "main",
      "head_oid": "2982f951552e94f38cd972764ae94c1d90c41da3",
      "cutoff_oid": "0c188278cdf9b8b717c2740550bdb0f69c02f6b5"
    },
    {
      "canonical_repository_id": "anuraghazra/github-readme-stats",
      "mirror_name": "github.com/sg-evals/anuraghazra-github-readme-stats",
      "exists": true,
      "is_fork": true,
      "parent": "anuraghazra/github-readme-stats",
      "visibility": "PUBLIC",
      "default_branch": "master",
      "head_oid": "54a7985aeefda00d5eadb55b80c17c7f976c37d2",
      "cutoff_oid": "54a7985aeefda00d5eadb55b80c17c7f976c37d2"
    },
    {
      "canonical_repository_id": "apache/couchdb",
      "mirror_name": "github.com/sg-evals/apache-couchdb",
      "exists": true,
      "is_fork": true,
      "parent": "apache/couchdb",
      "visibility": "PUBLIC",
      "default_branch": "main",
      "head_oid": "c2a97ae6829f7617e8be7612501c90aba6785f19",
      "cutoff_oid": "a2eedd4af19f40d9f92de3fd52ab3e922668748a"
    },
    {
      "canonical_repository_id": "apache/superset",
      "mirror_name": "github.com/sg-evals/apache-superset",
      "exists": true,
      "is_fork": true,
      "parent": "apache/superset",
      "visibility": "PUBLIC",
      "default_branch": "master",
      "head_oid": "4300e9fb9308404fd9f3b0c4be71ca13d631dfeb",
      "cutoff_oid": "8c37d627aa9c8351e7e60611cd3e1219495bb830"
    },
    {